{
    "ark": "ark:/21198/s1t907",
    "reconstruction": false,
    "label": "Sinai Arabic 497, Overtext (Naskh)",
    "state": {
        "id": "overtext",
        "label": "Overtext"
    },
    "writing": [
        {
            "script": [
                {
                    "id": "naskh",
                    "label": "Naskh",
                    "writing_system": "Arabic"
                }
            ]
        }
    ],
    "text_unit": [
        {
            "id": "ark:/21198/s1mt0j",
            "label": "Item 1"
        }
    ],
    "features": [
        {
            "id": "headpiece",
            "label": "Headpiece(s)"
        },
        {
            "id": "deco-vegetative",
            "label": "Decoration, Vegetative"
        }
    ],
    "assoc_date": [
        {
            "type": {
                "id": "origin",
                "label": "Date of Origin"
            },
            "value": "11th c.",
            "iso": {
                "not_before": "1001",
                "not_after": "1100"
            }
        }
    ],
    "note": [
        {
            "type": {
                "id": "ornamentation",
                "label": "Ornamentation Note"
            },
            "value": "Knotted vine headpieces between ff.62v-141r; f. 63r, arch"
        }
    ],
    "parent": [
        "ark:/21198/z1bk2x0s"
    ]
}