{
    "ark": "ark:/21198/s1vc9n",
    "reconstruction": false,
    "label": "Sinai Arabic 449, Overtext (Undetermined (Arabic))",
    "state": {
        "id": "overtext",
        "label": "Overtext"
    },
    "writing": [
        {
            "script": [
                {
                    "id": "arabic-undetermined",
                    "label": "Undetermined (Arabic)",
                    "writing_system": "Arabic"
                }
            ]
        }
    ],
    "text_unit": [
        {
            "id": "ark:/21198/s1p065",
            "label": "Item 1"
        }
    ],
    "assoc_date": [
        {
            "type": {
                "id": "origin",
                "label": "Date of Origin"
            },
            "value": "13th c.",
            "iso": {
                "not_before": "1201",
                "not_after": "1300"
            }
        }
    ],
    "parent": [
        "ark:/21198/z1tt5v70"
    ]
}