{
    "ark": "ark:/21198/s1c02v",
    "reconstruction": false,
    "label": "Sinai Arabic 311, Overtext (Naskh)",
    "state": {
        "id": "overtext",
        "label": "Overtext"
    },
    "writing": [
        {
            "script": [
                {
                    "id": "naskh",
                    "label": "Naskh",
                    "writing_system": "Arabic"
                }
            ]
        }
    ],
    "text_unit": [
        {
            "id": "ark:/21198/s15m1t",
            "label": "Item 1"
        }
    ],
    "assoc_date": [
        {
            "type": {
                "id": "origin",
                "label": "Date of Origin"
            },
            "value": "11th c.",
            "iso": {
                "not_before": "1001",
                "not_after": "1100"
            }
        }
    ],
    "parent": [
        "ark:/21198/z1b86xkt"
    ]
}