{
    "ark": "ark:/21198/s1z325",
    "reconstruction": false,
    "label": "Sinai Arabic 254, Overtext (Undetermined (Arabic))",
    "state": {
        "id": "overtext",
        "label": "Overtext"
    },
    "writing": [
        {
            "script": [
                {
                    "id": "arabic-undetermined",
                    "label": "Undetermined (Arabic)",
                    "writing_system": "Arabic"
                }
            ]
        }
    ],
    "text_unit": [
        {
            "id": "ark:/21198/s1rq0r",
            "label": "Item 1"
        }
    ],
    "features": [
        {
            "id": "dated",
            "label": "Dated"
        },
        {
            "id": "colophon",
            "label": "Colophon"
        }
    ],
    "para": [
        {
            "type": {
                "id": "colophon",
                "label": "Colophon"
            },
            "locus": "f. 39v",
            "lang": [
                {
                    "id": "arab1395",
                    "label": "Arabic"
                }
            ],
            "assoc_date": [
                {
                    "type": {
                        "id": "origin",
                        "label": "Date of Origin"
                    },
                    "value": "15 Ab 7240 (adam) :: 1732 (AD)"
                }
            ],
            "note": [
                "Attested places:  Mount Sinai ; City of David, Bethlehem"
            ]
        }
    ],
    "assoc_date": [
        {
            "type": {
                "id": "origin",
                "label": "Date of Origin"
            },
            "value": "1732",
            "iso": {
                "not_before": "1732"
            }
        }
    ],
    "parent": [
        "ark:/21198/z1xs6zqg"
    ]
}