{
    "ark": "ark:/21198/s12925",
    "reconstruction": false,
    "label": "Sinai Syriac NF M 11, Undertext (Christian Palestinian Aramaic)",
    "locus": "ff. 65–66, 97–104",
    "state": {
        "id": "undertext",
        "label": "Undertext"
    },
    "writing": [
        {
            "script": [
                {
                    "id": "cpa",
                    "label": "Christian Palestinian Aramaic",
                    "writing_system": "Syriac"
                }
            ],
            "note": [
                "Early large CPA"
            ]
        }
    ],
    "layout": [
        {
            "columns": "2 columns",
            "lines": "24 lines"
        }
    ],
    "text_unit": [
        {
            "id": "ark:/21198/s1q97z",
            "label": "Item 1"
        }
    ],
    "assoc_date": [
        {
            "type": {
                "id": "origin",
                "label": "Date of Origin"
            },
            "value": "6th-7th c. ",
            "iso": {
                "not_before": "0501",
                "not_after": "0700"
            }
        }
    ],
    "assoc_place": [
        {
            "value": "Possibly St. Catherine's Monastery",
            "event": {
                "id": "origin",
                "label": "Place of Origin"
            }
        }
    ],
    "note": [
        {
            "type": {
                "id": "foliation",
                "label": "Foliation Note"
            },
            "value": "Reconstructed folio order, ff. 101r, 102v, 100v, 99r, 100r, 99v, 101v, 102r, 104r, 103v, 97v, 98r, 97r, 98v, 104v, 103r, 66v, 65r, 66r, 65v"
        },
        {
            "type": {
                "id": "general",
                "label": "Other Notes"
            },
            "value": "Description of undertext by Christa Müller-Kessler"
        },
        {
            "type": {
                "id": "general",
                "label": "Other Notes"
            },
            "value": "Bibliography: Philothée, pp. 300-302; 303-305 (by A. Desreumaux)"
        }
    ],
    "parent": [
        "ark:/21198/r1vd6wc9"
    ]
}