{
    "ark": "ark:/21198/s19d0m",
    "reconstruction": false,
    "label": "Sinai Syriac 164, Overtext (Melkite)",
    "state": {
        "id": "overtext",
        "label": "Overtext"
    },
    "writing": [
        {
            "script": [
                {
                    "id": "melkite",
                    "label": "Melkite",
                    "writing_system": "Syriac"
                }
            ]
        }
    ],
    "text_unit": [
        {
            "id": "ark:/21198/s1408z",
            "label": "Item 1"
        }
    ],
    "assoc_date": [
        {
            "type": {
                "id": "origin",
                "label": "Date of Origin"
            },
            "value": "13th c.",
            "iso": {
                "not_before": "1201",
                "not_after": "1300"
            }
        }
    ],
    "parent": [
        "ark:/21198/z1q5479k"
    ]
}