{
    "ark": "ark:/21198/s1z927",
    "reconstruction": false,
    "label": "Sinai Georgian 49, Undertext (Estrangela)",
    "locus": "ff. 17, 19, 22, 31â€“32, 38",
    "state": {
        "id": "undertext",
        "label": "Undertext"
    },
    "writing": [
        {
            "script": [
                {
                    "id": "estrangela",
                    "label": "Estrangela",
                    "writing_system": "Syriac"
                }
            ]
        }
    ],
    "text_unit": [
        {
            "id": "ark:/21198/s1m971",
            "label": "Item 1"
        }
    ],
    "assoc_date": [
        {
            "type": {
                "id": "origin",
                "label": "Date of Origin"
            },
            "value": "5th-6th c. ",
            "iso": {
                "not_before": "0401",
                "not_after": "0600"
            }
        }
    ],
    "note": [
        {
            "type": {
                "id": "general",
                "label": "Other Notes"
            },
            "value": "Description of undertext by Grigory Kessel"
        }
    ],
    "parent": [
        "ark:/21198/z12v3d24"
    ]
}