{
    "ark": "ark:/21198/s1gp5t",
    "reconstruction": false,
    "label": "Sinai Arabic 104, Overtext (Naskh)",
    "state": {
        "id": "overtext",
        "label": "Overtext"
    },
    "writing": [
        {
            "script": [
                {
                    "id": "naskh",
                    "label": "Naskh",
                    "writing_system": "Arabic"
                }
            ]
        }
    ],
    "text_unit": [
        {
            "id": "ark:/21198/s19642",
            "label": "Item 1"
        }
    ],
    "features": [
        {
            "id": "dated",
            "label": "Dated"
        },
        {
            "id": "deco-geometric",
            "label": "Decoration, Geometric"
        },
        {
            "id": "deco-vegetative",
            "label": "Decoration, Vegetative"
        },
        {
            "id": "headpiece",
            "label": "Headpiece(s)"
        }
    ],
    "para": [
        {
            "type": {
                "id": "colophon",
                "label": "Colophon"
            },
            "locus": "f. 294r",
            "lang": [
                {
                    "id": "arab1395",
                    "label": "Arabic"
                }
            ],
            "as_written": "نجزت الاربعة مقالات المقدسة على تمامها وكمالها وكذلك عدد فصولها وكان الفراغ منها يوم الثلاثاء الرابع وعشرين من شهر حزيران سنة ست آلاف وسبعمائة تسعة وثمانين للعالم وذلك بجبل الله المقدس طور سيناء وهو برسم الشيخ أنبا ميخائيل الخمسي نفعه الله به وكل من قرأ فيه ودعا لناسخ الخاطئ بمغفرة خطاياه يكون له من السيد المسيح نظير ذلك والسبح لله دائما أبدا آمين ",
            "assoc_date": [
                {
                    "type": {
                        "id": "origin",
                        "label": "Date of Origin"
                    },
                    "value": "Tuesday 14 Huzayran 6789 (world)"
                }
            ],
            "note": [
                "Attested places:  Mount Sinai"
            ]
        }
    ],
    "assoc_date": [
        {
            "type": {
                "id": "origin",
                "label": "Date of Origin"
            },
            "value": "1281",
            "iso": {
                "not_before": "1281"
            }
        }
    ],
    "note": [
        {
            "type": {
                "id": "ornamentation",
                "label": "Ornamentation Note"
            },
            "value": "Ornate geometric headpiece, f. 135r, cross and knot motif, f. 1r ascending knots; f. 83r, knot motif with fleur de lis; f. 225r, vegetative and fleur de lis motif"
        }
    ],
    "parent": [
        "ark:/21198/z1x36g3q"
    ]
}