{
    "ark": "ark:/21198/s13p75",
    "reconstruction": false,
    "label": "Sinai Syriac 189, Overtext (Melkite)",
    "state": {
        "id": "overtext",
        "label": "Overtext"
    },
    "writing": [
        {
            "script": [
                {
                    "id": "melkite",
                    "label": "Melkite",
                    "writing_system": "Syriac"
                }
            ]
        }
    ],
    "text_unit": [
        {
            "id": "ark:/21198/s1x952",
            "label": "Item 1"
        }
    ],
    "features": [
        {
            "id": "headpiece",
            "label": "Headpiece(s)"
        },
        {
            "id": "deco-geometric",
            "label": "Decoration, Geometric"
        },
        {
            "id": "deco-zoomorph",
            "label": "Decoration, Zoomorphic"
        }
    ],
    "assoc_date": [
        {
            "type": {
                "id": "origin",
                "label": "Date of Origin"
            },
            "value": "13th c.",
            "iso": {
                "not_before": "1201",
                "not_after": "1300"
            }
        }
    ],
    "note": [
        {
            "type": {
                "id": "ornamentation",
                "label": "Ornamentation Note"
            },
            "value": "Minor geometric headpieces throughout, beginning on f. 27v | Zoomorphic headpiece, f. 171r, intertwined serpents"
        }
    ],
    "parent": [
        "ark:/21198/z14f2v32"
    ]
}