{
    "ark": "ark:/21198/s1q909",
    "reconstruction": false,
    "label": "Sinai Arabic 532, Overtext (Naskh)",
    "state": {
        "id": "overtext",
        "label": "Overtext"
    },
    "writing": [
        {
            "script": [
                {
                    "id": "naskh",
                    "label": "Naskh",
                    "writing_system": "Arabic"
                }
            ]
        }
    ],
    "text_unit": [
        {
            "id": "ark:/21198/s1hw8b",
            "label": "Item 1"
        }
    ],
    "features": [
        {
            "id": "dated",
            "label": "Dated"
        },
        {
            "id": "headpiece",
            "label": "Headpiece(s)"
        },
        {
            "id": "deco-vegetative",
            "label": "Decoration, Vegetative"
        },
        {
            "id": "colophon",
            "label": "Colophon"
        }
    ],
    "para": [
        {
            "type": {
                "id": "colophon",
                "label": "Colophon"
            },
            "locus": "f. 178v",
            "lang": [
                {
                    "id": "arab1395",
                    "label": "Arabic"
                }
            ],
            "as_written": "نجزت القصة المباركة يوم الاثنين التاسع وعشرين من أيلول سنة ست ألف وسبعمائه وخمسة وأربعين للعالم",
            "assoc_date": [
                {
                    "type": {
                        "id": "origin",
                        "label": "Date of Origin"
                    },
                    "value": "Tuesday 29 Aylul 6745"
                }
            ]
        }
    ],
    "assoc_date": [
        {
            "type": {
                "id": "origin",
                "label": "Date of Origin"
            },
            "value": "1237",
            "iso": {
                "not_before": "1237"
            }
        }
    ],
    "note": [
        {
            "type": {
                "id": "ornamentation",
                "label": "Ornamentation Note"
            },
            "value": "Vegetative headpiece on f. 2v"
        }
    ],
    "parent": [
        "ark:/21198/z14t7nnf"
    ]
}