{
    "ark": "ark:/21198/s12s4r",
    "reconstruction": false,
    "label": "Sinai Arabic 253, Overtext (Naskh)",
    "state": {
        "id": "overtext",
        "label": "Overtext"
    },
    "writing": [
        {
            "script": [
                {
                    "id": "naskh",
                    "label": "Naskh",
                    "writing_system": "Arabic"
                }
            ]
        }
    ],
    "text_unit": [
        {
            "id": "ark:/21198/s1wd31",
            "label": "Item 1"
        }
    ],
    "assoc_date": [
        {
            "type": {
                "id": "origin",
                "label": "Date of Origin"
            },
            "value": "13th c.",
            "iso": {
                "not_before": "1201",
                "not_after": "1300"
            }
        }
    ],
    "parent": [
        "ark:/21198/z1989rrt"
    ]
}