{
    "ark": "ark:/21198/s1jw3r",
    "reconstruction": false,
    "label": "Sinai Arabic 461, Overtext (Kufic)",
    "state": {
        "id": "overtext",
        "label": "Overtext"
    },
    "writing": [
        {
            "script": [
                {
                    "id": "kufic",
                    "label": "Kufic",
                    "writing_system": "Arabic"
                }
            ]
        }
    ],
    "text_unit": [
        {
            "id": "ark:/21198/s1ch3d",
            "label": "Item 1"
        }
    ],
    "assoc_date": [
        {
            "type": {
                "id": "origin",
                "label": "Date of Origin"
            },
            "value": "10th c.",
            "iso": {
                "not_before": "0901",
                "not_after": "1000"
            }
        }
    ],
    "parent": [
        "ark:/21198/z1v13pjk"
    ]
}