{
    "ark": "ark:/21198/s1831k",
    "reconstruction": false,
    "label": "Sinai Arabic 95, Overtext (Undetermined (Arabic))",
    "state": {
        "id": "overtext",
        "label": "Overtext"
    },
    "writing": [
        {
            "script": [
                {
                    "id": "arabic-undetermined",
                    "label": "Undetermined (Arabic)",
                    "writing_system": "Arabic"
                }
            ]
        }
    ],
    "text_unit": [
        {
            "id": "ark:/21198/s12p9m",
            "label": "Item 1"
        }
    ],
    "features": [
        {
            "id": "dated",
            "label": "Dated"
        },
        {
            "id": "border-deco",
            "label": "Border(s), Decorative"
        },
        {
            "id": "border",
            "label": "Border(s)"
        },
        {
            "id": "deco-architectural",
            "label": "Decoration, Architectural"
        },
        {
            "id": "deco-calligraphic",
            "label": "Decoration, Calligraphic"
        },
        {
            "id": "deco-full-page",
            "label": "Decoration, Full-page"
        },
        {
            "id": "headpiece",
            "label": "Headpiece(s)"
        },
        {
            "id": "deco-geometric",
            "label": "Decoration, Geometric"
        },
        {
            "id": "deco-vegetative",
            "label": "Decoration, Vegetative"
        },
        {
            "id": "table",
            "label": "Table(s)"
        },
        {
            "id": "colophon",
            "label": "Colophon"
        }
    ],
    "para": [
        {
            "type": {
                "id": "colophon",
                "label": "Colophon"
            },
            "locus": "ff. 340ar-340av",
            "lang": [
                {
                    "id": "arab1395",
                    "label": "Arabic"
                }
            ]
        }
    ],
    "assoc_date": [
        {
            "type": {
                "id": "origin",
                "label": "Date of Origin"
            },
            "value": "1277",
            "iso": {
                "not_before": "1277"
            }
        }
    ],
    "note": [
        {
            "type": {
                "id": "ornamentation",
                "label": "Ornamentation Note"
            },
            "value": "Ornate bordered headpiece with decorative calligraphy, vegetal, vine and floral motif down in the negative, red ink, ff.75v, 130v, 224v, without calligraphy, 285v"
        },
        {
            "type": {
                "id": "ornamentation",
                "label": "Ornamentation Note"
            },
            "value": "Ornate arched table, bordered by vegetative and floral vine motif and alternating geometric patterns, ff.127v-128r, 219v-221v, with minimal border and geometric decoration, f. 284v"
        }
    ],
    "parent": [
        "ark:/21198/z1vq4mbb"
    ]
}