{
    "ark": "ark:/21198/s1w32j",
    "reconstruction": false,
    "label": "Sinai Arabic 520, Overtext (Naskh)",
    "state": {
        "id": "overtext",
        "label": "Overtext"
    },
    "writing": [
        {
            "script": [
                {
                    "id": "naskh",
                    "label": "Naskh",
                    "writing_system": "Arabic"
                }
            ]
        }
    ],
    "text_unit": [
        {
            "id": "ark:/21198/s1pm2v",
            "label": "Item 1"
        }
    ],
    "features": [
        {
            "id": "headpiece",
            "label": "Headpiece(s)"
        },
        {
            "id": "deco-geometric",
            "label": "Decoration, Geometric"
        }
    ],
    "assoc_date": [
        {
            "type": {
                "id": "origin",
                "label": "Date of Origin"
            },
            "value": "10th c.",
            "iso": {
                "not_before": "0901",
                "not_after": "1000"
            }
        }
    ],
    "note": [
        {
            "type": {
                "id": "ornamentation",
                "label": "Ornamentation Note"
            },
            "value": "Minor geometric headpieces throughout, beginning on f. 11r"
        }
    ],
    "parent": [
        "ark:/21198/z1c26f13"
    ]
}